{
  "required" : true ,
  "$schema" : "http://json-schema.org/draft-03/schema" ,
  "type" : "object" ,
  "properties" : {
    "id" : {
      "type" : "string" ,
      "required" : false
    } ,
    "created_at" : {
      "type" : "number" ,
      "required" : false
    } ,
    "day" : {
      "type" : "string" ,
      "required" : false
    } ,
    "due_at" : {
      "type" : "number" ,
      "required" : false
    } ,
    "due_time" : {
      "type" : "string" ,
      "required" : false
    } ,
    "profile_id" : {
      "type" : "string" ,
      "required" : false
    } ,
    "profile_service" : {
      "type" : "string" ,
      "required" : false
    } ,
    "sent_at" : {
      "type" : "number" ,
      "required" : false
    } ,
    "service_update_id" : {
      "type" : "string" ,
      "required" : false
    } ,
    "statistics" : {
      "type" : "object" ,
      "required" : false ,
      "properties" : {
        "reach" : {
          "type" : "number" ,
          "required" : false
        } ,
        "clicks" : {
          "type" : "number" ,
          "required" : false
        } ,
        "retweets" : {
          "type" : "number" ,
          "required" : false
        } ,
        "favorites" : {
          "type" : "number" ,
          "required" : false
        } ,
        "mentions" : {
          "type" : "number" ,
          "required" : false
        }
      }
    } ,
    "status" : {
      "type" : "string" ,
      "required" : false
    } ,
    "text" : {
      "type" : "string" ,
      "required" : false
    } ,
    "text_formatted" : {
      "type" : "string" ,
      "required" : false
    } ,
    "user_id" : {
      "type" : "string" ,
      "required" : false
    } ,
    "via" : {
      "type" : "string" ,
      "required" : false
    }
  }
}