{
  "id" : "4eb8565e0acb04bb82000004" ,
  "created_at" : 1320703582 ,
  "day" : "Monday 7th November" ,
  "due_at" : 1320742680 ,
  "due_time" : "10:09 pm" ,
  "profile_id" : "4eb854340acb04e870000010" ,
  "profile_service" : "twitter" ,
  "sent_at" : 1320744001 ,
  "service_update_id" : "133667319959392256" ,
  "statistics" : {
    "reach" : 2460 ,
    "clicks" : 56 ,
    "retweets" : 20 ,
    "favorites" : 1 ,
    "mentions" : 1
  } ,
  "status" : "sent" ,
  "text" : "This is just the beginning, the very beginning, of the transfor..." ,
  "text_formatted" : "This is just the beginning, the very beginning, of th..." ,
  "user_id" : "4eb9276e0acb04bb81000067" ,
  "via" : "chrome"
}